{"referencia":"KOS-SG-CATALOGO-BASE-2026-10-06","version":"v0.1","estado":"BASE CANÓNICA · EN EVOLUCIÓN","fecha":"2026-10-06","criterio":"La interpretación no describe literalmente el dibujo; asigna un significado funcional reutilizable.","regla_coherencia":{"semantico_fijo":"Uso estable para conceptos nucleares del sistema.","semantico_contextual":"Uso dependiente del ámbito, conservando familia conceptual.","decorativo":"Uso libre para ritmo, estética, cercanía o jerarquización sin carga semántica fuerte."},"familias":[{"slug":"direccion-estrategia-decision","titulo":"DIRECCIÓN · ESTRATEGIA · DECISIÓN"},{"slug":"persona-comunidad-relaciones","titulo":"PERSONA · COMUNIDAD · RELACIONES"},{"slug":"ia-tecnologia-computacion","titulo":"IA · TECNOLOGÍA · COMPUTACIÓN"},{"slug":"datos-memoria-conocimiento","titulo":"DATOS · MEMORIA · CONOCIMIENTO"},{"slug":"conexion-integracion-acceso","titulo":"CONEXIÓN · INTEGRACIÓN · ACCESO"},{"slug":"seguridad-control-gobernanza","titulo":"SEGURIDAD · CONTROL · GOBERNANZA"},{"slug":"accion-ejecucion-operaciones","titulo":"ACCIÓN · EJECUCIÓN · OPERACIONES"},{"slug":"experimentacion-innovacion-creatividad","titulo":"EXPERIMENTACIÓN · INNOVACIÓN · CREATIVIDAD"},{"slug":"comunicacion-difusion-interaccion","titulo":"COMUNICACIÓN · DIFUSIÓN · INTERACCIÓN"},{"slug":"web-codigo-desarrollo","titulo":"WEB · CÓDIGO · DESARROLLO"},{"slug":"tiempo-agenda-organizacion","titulo":"TIEMPO · AGENDA · ORGANIZACIÓN"},{"slug":"negocio-recursos-economia","titulo":"NEGOCIO · RECURSOS · ECONOMÍA"},{"slug":"educacion-investigacion-aprendizaje","titulo":"EDUCACIÓN · INVESTIGACIÓN · APRENDIZAJE"},{"slug":"multimedia-contenido-cultura","titulo":"MULTIMEDIA · CONTENIDO · CULTURA"},{"slug":"movilidad-espacio-mundo-fisico","titulo":"MOVILIDAD · ESPACIO · MUNDO FÍSICO"},{"slug":"iconos-especiales-uso-contextual","titulo":"ICONOS ESPECIALES · USO CONTEXTUAL"}],"iconos":[{"id":1,"icono":"🧭","slug":"brujula","nombre":"Dirección","familia":"direccion-estrategia-decision","estado_semantico":"fijo","significado_funcional":"Señala orientación estratégica, criterio y elección de rumbo."},{"id":2,"icono":"🚩","slug":"bandera","nombre":"Objetivo","familia":"direccion-estrategia-decision","estado_semantico":"fijo","significado_funcional":"Marca una meta, hito o punto que debe alcanzarse."},{"id":3,"icono":"🔮","slug":"globo-vision","nombre":"Visión","familia":"direccion-estrategia-decision","estado_semantico":"contextual","significado_funcional":"Representa anticipación, prospectiva y escenarios futuros."},{"id":4,"icono":"📍","slug":"ubicacion-posicion","nombre":"Posición","familia":"direccion-estrategia-decision","estado_semantico":"contextual","significado_funcional":"Indica dónde estamos física, digital u operativamente."},{"id":5,"icono":"🌳","slug":"arbol-evolucion","nombre":"Evolución","familia":"direccion-estrategia-decision","estado_semantico":"contextual","significado_funcional":"Representa desarrollo orgánico, raíces, ramificación y largo plazo."},{"id":6,"icono":"💎","slug":"diamante-valor","nombre":"Valor","familia":"direccion-estrategia-decision","estado_semantico":"contextual","significado_funcional":"Identifica aquello especialmente valioso, diferencial o estratégico."},{"id":7,"icono":"👤","slug":"usuario","nombre":"Persona","familia":"persona-comunidad-relaciones","estado_semantico":"fijo","significado_funcional":"Representa al individuo como sujeto del sistema."},{"id":8,"icono":"🙌","slug":"persona-comunidad","nombre":"Participación","familia":"persona-comunidad-relaciones","estado_semantico":"contextual","significado_funcional":"Expresa colaboración, comunidad o acción colectiva."},{"id":9,"icono":"🙂","slug":"bienestar","nombre":"Experiencia humana","familia":"persona-comunidad-relaciones","estado_semantico":"contextual","significado_funcional":"Indica satisfacción, bienestar o dimensión personal."},{"id":10,"icono":"♡","slug":"corazon-afinidad","nombre":"Afinidad","familia":"persona-comunidad-relaciones","estado_semantico":"contextual","significado_funcional":"Representa vínculo, interés, cuidado o preferencia."},{"id":11,"icono":"💖","slug":"corazon-dinamico","nombre":"Conexión","familia":"persona-comunidad-relaciones","estado_semantico":"contextual","significado_funcional":"Señala una relación especialmente significativa o activa."},{"id":12,"icono":"🐾","slug":"huella","nombre":"Rastro","familia":"persona-comunidad-relaciones","estado_semantico":"contextual","significado_funcional":"Representa recorrido, presencia, legado o trazabilidad humana."},{"id":13,"icono":"🤖","slug":"robot","nombre":"Inteligencia artificial","familia":"ia-tecnologia-computacion","estado_semantico":"fijo","significado_funcional":"Identifica agentes, automatización o sistemas autónomos."},{"id":14,"icono":"⚛️","slug":"atomo","nombre":"Ciencia/IA","familia":"ia-tecnologia-computacion","estado_semantico":"contextual","significado_funcional":"Representa ciencia, inteligencia avanzada, investigación o arquitectura tecnológica."},{"id":15,"icono":"⚛️","slug":"red-inter-ia","nombre":"Inter-IA","familia":"ia-tecnologia-computacion","estado_semantico":"fijo","significado_funcional":"Expresa interacción y coordinación entre inteligencias o nodos."},{"id":16,"icono":"🖥️","slug":"chip","nombre":"Computación","familia":"ia-tecnologia-computacion","estado_semantico":"fijo","significado_funcional":"Identifica capacidad de procesamiento, hardware o infraestructura digital."},{"id":17,"icono":"💻","slug":"ordenador","nombre":"Entorno digital","familia":"ia-tecnologia-computacion","estado_semantico":"contextual","significado_funcional":"Representa trabajo informático, software y puesto operativo."},{"id":18,"icono":"🌐","slug":"globo-red-global","nombre":"Red global","familia":"ia-tecnologia-computacion","estado_semantico":"contextual","significado_funcional":"Identifica Internet, ecosistema conectado o alcance mundial."},{"id":19,"icono":"🌐✨","slug":"mundo-exploracion","nombre":"Exploración","familia":"ia-tecnologia-computacion","estado_semantico":"contextual","significado_funcional":"Representa descubrimiento tecnológico, nuevas posibilidades o expansión."},{"id":20,"icono":"🗄️","slug":"base-de-datos","nombre":"Datos","familia":"datos-memoria-conocimiento","estado_semantico":"fijo","significado_funcional":"Representa información estructurada, almacenamiento y memoria operativa."},{"id":21,"icono":"📕","slug":"libro","nombre":"Conocimiento","familia":"datos-memoria-conocimiento","estado_semantico":"fijo","significado_funcional":"Identifica documentación, referencia o conocimiento consolidado."},{"id":22,"icono":"📓","slug":"cuaderno","nombre":"Registro","familia":"datos-memoria-conocimiento","estado_semantico":"contextual","significado_funcional":"Representa notas, aprendizaje y conocimiento en construcción."},{"id":23,"icono":"📄","slug":"documento","nombre":"Información formal","familia":"datos-memoria-conocimiento","estado_semantico":"fijo","significado_funcional":"Identifica archivos, informes, contratos o piezas documentales."},{"id":24,"icono":"📋","slug":"portapapeles","nombre":"Registro operativo","familia":"datos-memoria-conocimiento","estado_semantico":"fijo","significado_funcional":"Representa checklist, expediente o información que debe gestionarse."},{"id":25,"icono":"🔖","slug":"marcador","nombre":"Referencia","familia":"datos-memoria-conocimiento","estado_semantico":"contextual","significado_funcional":"Señala información que merece conservarse o recuperarse posteriormente."},{"id":26,"icono":"🧾","slug":"recibo-tarea-verificada","nombre":"Evidencia","familia":"datos-memoria-conocimiento","estado_semantico":"fijo","significado_funcional":"Representa comprobación, justificante o resultado verificable."},{"id":27,"icono":"🔗","slug":"enlace","nombre":"Conexión","familia":"conexion-integracion-acceso","estado_semantico":"fijo","significado_funcional":"Representa relación entre sistemas, recursos, personas o información."},{"id":28,"icono":"🔑","slug":"llave","nombre":"Acceso","familia":"conexion-integracion-acceso","estado_semantico":"fijo","significado_funcional":"Identifica permisos, credenciales, capacidad de entrada o autorización."},{"id":29,"icono":"🔓","slug":"candado-abierto","nombre":"Apertura","familia":"conexion-integracion-acceso","estado_semantico":"contextual","significado_funcional":"Señala recurso accesible, desbloqueado o autorizado."},{"id":30,"icono":"🔳","slug":"qr-modulos","nombre":"Interconexión","familia":"conexion-integracion-acceso","estado_semantico":"contextual","significado_funcional":"Representa estructura modular, identificación o conexión máquina-máquina."},{"id":31,"icono":"🔷","slug":"elemento-nodo","nombre":"Nodo","familia":"conexion-integracion-acceso","estado_semantico":"contextual","significado_funcional":"Identifica una unidad, componente o pieza dentro de una arquitectura."},{"id":32,"icono":"⬆️","slug":"compartir","nombre":"Transferencia","familia":"conexion-integracion-acceso","estado_semantico":"contextual","significado_funcional":"Representa publicar, exportar, enviar o hacer disponible."},{"id":33,"icono":"🛡️","slug":"escudo","nombre":"Protección","familia":"seguridad-control-gobernanza","estado_semantico":"fijo","significado_funcional":"Representa seguridad, defensa, gobernanza y salvaguardas."},{"id":34,"icono":"🚫","slug":"prohibicion","nombre":"Veto","familia":"seguridad-control-gobernanza","estado_semantico":"fijo","significado_funcional":"Señala aquello que no debe ejecutarse o atravesar un límite."},{"id":35,"icono":"⏰✓","slug":"alarma-verificada","nombre":"Control","familia":"seguridad-control-gobernanza","estado_semantico":"fijo","significado_funcional":"Representa una condición temporal que debe cumplirse o comprobarse."},{"id":36,"icono":"🐞","slug":"bug","nombre":"Incidencia","familia":"seguridad-control-gobernanza","estado_semantico":"fijo","significado_funcional":"Identifica error, vulnerabilidad o comportamiento que necesita corrección."},{"id":37,"icono":"☂️","slug":"paraguas","nombre":"Cobe